{
  "meta": {
    "case_id": "freelance-invoice-gst",
    "created_at": "2026-06-09",
    "description": "Create a local invoicing tool for an Indian freelancer. Manage clients and projects, generate GST-compliant invoices wit"
  },
  "requirements": [
    {
      "id": "R1",
      "term": "markdown output",
      "description": "Output in Markdown format",
      "match_patterns": [
        "(?i)markdown"
      ]
    },
    {
      "id": "R2",
      "term": "deterministic model",
      "description": "Uses deterministic computation (not probabilistic/LLM-driven)",
      "match_patterns": [
        "(?i)deterministic.*(model|comput|engine|math|calcul)"
      ]
    },
    {
      "id": "R3",
      "term": "LLM narration from structured only",
      "description": "LLM narrates from structured outputs only, never raw data",
      "match_patterns": [
        "(?i)llm.*narrat",
        "(?i)structured.*out.*only",
        "(?i)never.*raw"
      ]
    }
  ],
  "non_goals": [
    {
      "id": "NG1",
      "term": "GST return filing",
      "leak_patterns": [
        "(?i)return.*(?:implement|phase|build|component|create|route|endpoint|schema|module)",
        "(?i)(?:implement|phase|build|component|create|route|endpoint|schema|module).*return"
      ],
      "safe_patterns": [
        "(?i)non.?goal",
        "(?i)not.*v1",
        "(?i)defer",
        "(?i)explicit.*non",
        "(?i)out.*of.*scope"
      ]
    },
    {
      "id": "NG2",
      "term": "payment-gateway integration",
      "leak_patterns": [
        "(?i)payment\\-gateway.*(?:implement|phase|build|component|create|route|endpoint|schema|module)",
        "(?i)(?:implement|phase|build|component|create|route|endpoint|schema|module).*payment\\-gateway"
      ],
      "safe_patterns": [
        "(?i)non.?goal",
        "(?i)not.*v1",
        "(?i)defer",
        "(?i)explicit.*non",
        "(?i)out.*of.*scope"
      ]
    },
    {
      "id": "NG3",
      "term": "cloud LLM default",
      "leak_patterns": [
        "(?i)LLM.*(?:implement|phase|build|component|create|route|endpoint|schema|module)",
        "(?i)(?:implement|phase|build|component|create|route|endpoint|schema|module).*LLM"
      ],
      "safe_patterns": [
        "(?i)non.?goal",
        "(?i)not.*v1",
        "(?i)defer",
        "(?i)explicit.*non",
        "(?i)out.*of.*scope"
      ]
    },
    {
      "id": "NG4",
      "term": "React UI",
      "leak_patterns": [
        "(?i)React.*(?:implement|phase|build|component|create|route|endpoint|schema|module)",
        "(?i)(?:implement|phase|build|component|create|route|endpoint|schema|module).*React"
      ],
      "safe_patterns": [
        "(?i)non.?goal",
        "(?i)not.*v1",
        "(?i)defer",
        "(?i)explicit.*non",
        "(?i)out.*of.*scope"
      ]
    },
    {
      "id": "NG5",
      "term": "multi-user accounting",
      "leak_patterns": [
        "(?i)multi\\-user.*(?:implement|phase|build|component|create|route|endpoint|schema|module)",
        "(?i)(?:implement|phase|build|component|create|route|endpoint|schema|module).*multi\\-user"
      ],
      "safe_patterns": [
        "(?i)non.?goal",
        "(?i)not.*v1",
        "(?i)defer",
        "(?i)explicit.*non",
        "(?i)out.*of.*scope"
      ]
    },
    {
      "id": "NG6",
      "term": "PDF rendering engine in v1",
      "leak_patterns": [
        "(?i)rendering.*(?:implement|phase|build|component|create|route|endpoint|schema|module)",
        "(?i)(?:implement|phase|build|component|create|route|endpoint|schema|module).*rendering"
      ],
      "safe_patterns": [
        "(?i)non.?goal",
        "(?i)not.*v1",
        "(?i)defer",
        "(?i)explicit.*non",
        "(?i)out.*of.*scope"
      ]
    },
    {
      "id": "NG7",
      "term": "emailing invoices automatically",
      "leak_patterns": [
        "(?i)automatically.*(?:implement|phase|build|component|create|route|endpoint|schema|module)",
        "(?i)(?:implement|phase|build|component|create|route|endpoint|schema|module).*automatically"
      ],
      "safe_patterns": [
        "(?i)non.?goal",
        "(?i)not.*v1",
        "(?i)defer",
        "(?i)explicit.*non",
        "(?i)out.*of.*scope"
      ]
    }
  ],
  "deferred": [
    {
      "id": "D1",
      "term": "recurring invoices"
    },
    {
      "id": "D2",
      "term": "multi-currency"
    },
    {
      "id": "D3",
      "term": "expense tracking"
    }
  ],
  "stack": {
    "required": [
      "Python CLI",
      "SQLite",
      "Jinja2 invoice templates",
      "Ollama"
    ],
    "forbidden": [],
    "allow_justified_deviation": true
  },
  "limits": {
    "active_clients": {
      "value": 50,
      "match_pattern": "(?i)(max|limit|cap).*50.*active\\ clients",
      "comparison": "eq"
    }
  },
  "artifacts": {
    "required_files": [
      ".prd-reviews/*/prd-draft.md",
      ".prd-reviews/*/prd-review.md",
      ".designs/*/design-doc.md",
      ".plan-reviews/*/state.env"
    ],
    "required_sections": {
      ".prd-reviews/*/prd-draft.md": [
        "Problem Statement",
        "Goals",
        "Non-Goals",
        "Constraints"
      ],
      ".prd-reviews/*/prd-review.md": [
        "Executive Summary"
      ],
      ".designs/*/design-doc.md": [
        "Data Model",
        "Security"
      ]
    }
  }
}