{
  "meta": {
    "case_id": "credit-score-simulator",
    "created_at": "2026-06-09",
    "description": "Build a local what-if credit-health simulator. The user manually enters their current loans, credit-card limits, utiliza"
  },
  "requirements": [
    {
      "id": "R1",
      "term": "s drivers from structured",
      "description": "Provide s drivers from structured capability",
      "match_patterns": [
        "(?i)s\\ drivers\\ from\\ structured"
      ]
    },
    {
      "id": "R2",
      "term": "a Markdown what-if",
      "description": "Provide a Markdown what-if capability",
      "match_patterns": [
        "(?i)a\\ Markdown\\ what\\-if"
      ]
    },
    {
      "id": "R3",
      "term": "markdown output",
      "description": "Output in Markdown format",
      "match_patterns": [
        "(?i)markdown"
      ]
    },
    {
      "id": "R4",
      "term": "deterministic model",
      "description": "Uses deterministic computation (not probabilistic/LLM-driven)",
      "match_patterns": [
        "(?i)deterministic.*(model|comput|engine|math|calcul)"
      ]
    },
    {
      "id": "R5",
      "term": "LLM narration from structured only",
      "description": "LLM narrates from structured outputs only, never raw data",
      "match_patterns": [
        "(?i)llm.*narrat",
        "(?i)structured.*out.*only",
        "(?i)never.*raw"
      ]
    }
  ],
  "non_goals": [
    {
      "id": "NG1",
      "term": "pulling real bureau scores",
      "leak_patterns": [
        "(?i)pulling.*(?:implement|phase|build|component|create|route|endpoint|schema|module)",
        "(?i)(?:implement|phase|build|component|create|route|endpoint|schema|module).*pulling"
      ],
      "safe_patterns": [
        "(?i)non.?goal",
        "(?i)not.*v1",
        "(?i)defer",
        "(?i)explicit.*non",
        "(?i)out.*of.*scope"
      ]
    },
    {
      "id": "NG2",
      "term": "bureau API integration",
      "leak_patterns": [
        "(?i)integration.*(?:implement|phase|build|component|create|route|endpoint|schema|module)",
        "(?i)(?:implement|phase|build|component|create|route|endpoint|schema|module).*integration"
      ],
      "safe_patterns": [
        "(?i)non.?goal",
        "(?i)not.*v1",
        "(?i)defer",
        "(?i)explicit.*non",
        "(?i)out.*of.*scope"
      ]
    },
    {
      "id": "NG3",
      "term": "cloud LLM default",
      "leak_patterns": [
        "(?i)LLM.*(?:implement|phase|build|component|create|route|endpoint|schema|module)",
        "(?i)(?:implement|phase|build|component|create|route|endpoint|schema|module).*LLM"
      ],
      "safe_patterns": [
        "(?i)non.?goal",
        "(?i)not.*v1",
        "(?i)defer",
        "(?i)explicit.*non",
        "(?i)out.*of.*scope"
      ]
    },
    {
      "id": "NG4",
      "term": "React UI",
      "leak_patterns": [
        "(?i)React.*(?:implement|phase|build|component|create|route|endpoint|schema|module)",
        "(?i)(?:implement|phase|build|component|create|route|endpoint|schema|module).*React"
      ],
      "safe_patterns": [
        "(?i)non.?goal",
        "(?i)not.*v1",
        "(?i)defer",
        "(?i)explicit.*non",
        "(?i)out.*of.*scope"
      ]
    },
    {
      "id": "NG5",
      "term": "multi-user",
      "leak_patterns": [
        "(?i)multi\\-user.*(?:implement|phase|build|component|create|route|endpoint|schema|module)",
        "(?i)(?:implement|phase|build|component|create|route|endpoint|schema|module).*multi\\-user"
      ],
      "safe_patterns": [
        "(?i)non.?goal",
        "(?i)not.*v1",
        "(?i)defer",
        "(?i)explicit.*non",
        "(?i)out.*of.*scope"
      ]
    },
    {
      "id": "NG6",
      "term": "lending/credit offers",
      "leak_patterns": [
        "(?i)lending/credit.*(?:implement|phase|build|component|create|route|endpoint|schema|module)",
        "(?i)(?:implement|phase|build|component|create|route|endpoint|schema|module).*lending/credit"
      ],
      "safe_patterns": [
        "(?i)non.?goal",
        "(?i)not.*v1",
        "(?i)defer",
        "(?i)explicit.*non",
        "(?i)out.*of.*scope"
      ]
    },
    {
      "id": "NG7",
      "term": "selling user data",
      "leak_patterns": [
        "(?i)selling.*(?:implement|phase|build|component|create|route|endpoint|schema|module)",
        "(?i)(?:implement|phase|build|component|create|route|endpoint|schema|module).*selling"
      ],
      "safe_patterns": [
        "(?i)non.?goal",
        "(?i)not.*v1",
        "(?i)defer",
        "(?i)explicit.*non",
        "(?i)out.*of.*scope"
      ]
    }
  ],
  "deferred": [
    {
      "id": "D1",
      "term": "bureau report import"
    },
    {
      "id": "D2",
      "term": "score-history tracking"
    },
    {
      "id": "D3",
      "term": "mobile app"
    }
  ],
  "stack": {
    "required": [
      "Python CLI",
      "SQLite",
      "Ollama"
    ],
    "forbidden": [],
    "allow_justified_deviation": true
  },
  "limits": {
    "what-if_scenarios_per_run": {
      "value": 3,
      "match_pattern": "(?i)(max|limit|cap).*3.*what\\-if\\ scenari",
      "comparison": "eq"
    },
    "tradelines": {
      "value": 10,
      "match_pattern": "(?i)(max|limit|cap).*10.*tradelines",
      "comparison": "eq"
    },
    "formats": {
      "value": 1,
      "match_pattern": "(?i)(exact|support|v1).*1.*(csv|format|source|template)",
      "comparison": "eq"
    }
  },
  "artifacts": {
    "required_files": [
      ".prd-reviews/*/prd-draft.md",
      ".prd-reviews/*/prd-review.md",
      ".designs/*/design-doc.md",
      ".plan-reviews/*/state.env"
    ],
    "required_sections": {
      ".prd-reviews/*/prd-draft.md": [
        "Problem Statement",
        "Goals",
        "Non-Goals",
        "Constraints"
      ],
      ".prd-reviews/*/prd-review.md": [
        "Executive Summary"
      ],
      ".designs/*/design-doc.md": [
        "Data Model",
        "Security"
      ]
    }
  }
}