{
  "meta": {
    "case_id": "tax-harvesting-advisor",
    "created_at": "2026-06-09",
    "description": "Create a local capital-gains tax-loss-harvesting advisor for one Indian retail investor. Ingest broker tradebook and hol"
  },
  "requirements": [
    {
      "id": "R1",
      "term": "Output a Markdown harvesting",
      "description": "Provide Output a Markdown harvesting capability",
      "match_patterns": [
        "(?i)Output\\ a\\ Markdown\\ harvesting"
      ]
    },
    {
      "id": "R2",
      "term": "markdown output",
      "description": "Output in Markdown format",
      "match_patterns": [
        "(?i)markdown"
      ]
    },
    {
      "id": "R3",
      "term": "deterministic model",
      "description": "Uses deterministic computation (not probabilistic/LLM-driven)",
      "match_patterns": [
        "(?i)deterministic.*(model|comput|engine|math|calcul)"
      ]
    },
    {
      "id": "R4",
      "term": "LLM narration from structured only",
      "description": "LLM narrates from structured outputs only, never raw data",
      "match_patterns": [
        "(?i)llm.*narrat",
        "(?i)structured.*out.*only",
        "(?i)never.*raw"
      ]
    }
  ],
  "non_goals": [
    {
      "id": "NG1",
      "term": "order placement",
      "leak_patterns": [
        "(?i)placement.*(?:implement|phase|build|component|create|route|endpoint|schema|module)",
        "(?i)(?:implement|phase|build|component|create|route|endpoint|schema|module).*placement"
      ],
      "safe_patterns": [
        "(?i)non.?goal",
        "(?i)not.*v1",
        "(?i)defer",
        "(?i)explicit.*non",
        "(?i)out.*of.*scope"
      ]
    },
    {
      "id": "NG2",
      "term": "broker API trading",
      "leak_patterns": [
        "(?i)trading.*(?:implement|phase|build|component|create|route|endpoint|schema|module)",
        "(?i)(?:implement|phase|build|component|create|route|endpoint|schema|module).*trading"
      ],
      "safe_patterns": [
        "(?i)non.?goal",
        "(?i)not.*v1",
        "(?i)defer",
        "(?i)explicit.*non",
        "(?i)out.*of.*scope"
      ]
    },
    {
      "id": "NG3",
      "term": "tax filing/ITR submission",
      "leak_patterns": [
        "(?i)filing/ITR.*(?:implement|phase|build|component|create|route|endpoint|schema|module)",
        "(?i)(?:implement|phase|build|component|create|route|endpoint|schema|module).*filing/ITR"
      ],
      "safe_patterns": [
        "(?i)non.?goal",
        "(?i)not.*v1",
        "(?i)defer",
        "(?i)explicit.*non",
        "(?i)out.*of.*scope"
      ]
    },
    {
      "id": "NG4",
      "term": "cloud LLM default",
      "leak_patterns": [
        "(?i)LLM.*(?:implement|phase|build|component|create|route|endpoint|schema|module)",
        "(?i)(?:implement|phase|build|component|create|route|endpoint|schema|module).*LLM"
      ],
      "safe_patterns": [
        "(?i)non.?goal",
        "(?i)not.*v1",
        "(?i)defer",
        "(?i)explicit.*non",
        "(?i)out.*of.*scope"
      ]
    },
    {
      "id": "NG5",
      "term": "React UI",
      "leak_patterns": [
        "(?i)React.*(?:implement|phase|build|component|create|route|endpoint|schema|module)",
        "(?i)(?:implement|phase|build|component|create|route|endpoint|schema|module).*React"
      ],
      "safe_patterns": [
        "(?i)non.?goal",
        "(?i)not.*v1",
        "(?i)defer",
        "(?i)explicit.*non",
        "(?i)out.*of.*scope"
      ]
    },
    {
      "id": "NG6",
      "term": "multi-user",
      "leak_patterns": [
        "(?i)multi\\-user.*(?:implement|phase|build|component|create|route|endpoint|schema|module)",
        "(?i)(?:implement|phase|build|component|create|route|endpoint|schema|module).*multi\\-user"
      ],
      "safe_patterns": [
        "(?i)non.?goal",
        "(?i)not.*v1",
        "(?i)defer",
        "(?i)explicit.*non",
        "(?i)out.*of.*scope"
      ]
    },
    {
      "id": "NG7",
      "term": "rebalancing automation",
      "leak_patterns": [
        "(?i)rebalancing.*(?:implement|phase|build|component|create|route|endpoint|schema|module)",
        "(?i)(?:implement|phase|build|component|create|route|endpoint|schema|module).*rebalancing"
      ],
      "safe_patterns": [
        "(?i)non.?goal",
        "(?i)not.*v1",
        "(?i)defer",
        "(?i)explicit.*non",
        "(?i)out.*of.*scope"
      ]
    },
    {
      "id": "NG8",
      "term": "derivatives/F&O",
      "leak_patterns": [
        "(?i)derivatives/F\\&O.*(?:implement|phase|build|component|create|route|endpoint|schema|module)",
        "(?i)(?:implement|phase|build|component|create|route|endpoint|schema|module).*derivatives/F\\&O"
      ],
      "safe_patterns": [
        "(?i)non.?goal",
        "(?i)not.*v1",
        "(?i)defer",
        "(?i)explicit.*non",
        "(?i)out.*of.*scope"
      ]
    },
    {
      "id": "NG9",
      "term": "sending holdings to any LLM",
      "leak_patterns": [
        "(?i)holdings.*(?:implement|phase|build|component|create|route|endpoint|schema|module)",
        "(?i)(?:implement|phase|build|component|create|route|endpoint|schema|module).*holdings"
      ],
      "safe_patterns": [
        "(?i)non.?goal",
        "(?i)not.*v1",
        "(?i)defer",
        "(?i)explicit.*non",
        "(?i)out.*of.*scope"
      ]
    }
  ],
  "deferred": [
    {
      "id": "D1",
      "term": "debt instruments"
    },
    {
      "id": "D2",
      "term": "multi-broker merge"
    },
    {
      "id": "D3",
      "term": "what-if scenarios"
    }
  ],
  "stack": {
    "required": [
      "Python CLI",
      "Pandas",
      "DuckDB",
      "Ollama"
    ],
    "forbidden": [],
    "allow_justified_deviation": true
  },
  "limits": {
    "financial_year_per_run": {
      "value": 1,
      "match_pattern": "(?i)(max|limit|cap).*1.*financial\\ year\\ ",
      "comparison": "eq"
    },
    "formats": {
      "value": 2,
      "match_pattern": "(?i)(exact|support|v1).*2.*(csv|format|source|template)",
      "comparison": "eq"
    }
  },
  "artifacts": {
    "required_files": [
      ".prd-reviews/*/prd-draft.md",
      ".prd-reviews/*/prd-review.md",
      ".designs/*/design-doc.md",
      ".plan-reviews/*/state.env"
    ],
    "required_sections": {
      ".prd-reviews/*/prd-draft.md": [
        "Problem Statement",
        "Goals",
        "Non-Goals",
        "Constraints"
      ],
      ".prd-reviews/*/prd-review.md": [
        "Executive Summary"
      ],
      ".designs/*/design-doc.md": [
        "Data Model",
        "Security"
      ]
    }
  }
}